{"behaviorDivergedBeforeVerification":true,"exactlyOneHarnessComponentChanged":true,"faultyPassed":false,"faultyReplayHashes":["sha256:2fada9831e47a9317f666609a8cf11c3cffde013341f4f2f68f655b24e78ab52","sha256:2fada9831e47a9317f666609a8cf11c3cffde013341f4f2f68f655b24e78ab52","sha256:2fada9831e47a9317f666609a8cf11c3cffde013341f4f2f68f655b24e78ab52"],"faultyReplayHashesIdentical":true,"fixtureId":"hfb-v0-routing-subagent-04","goodReplayHashes":["sha256:8aea28619bff02e469ac29186ccc0e931519035abe6d08490cd2b14801ac81ba","sha256:8aea28619bff02e469ac29186ccc0e931519035abe6d08490cd2b14801ac81ba","sha256:8aea28619bff02e469ac29186ccc0e931519035abe6d08490cd2b14801ac81ba"],"goodReplayHashesIdentical":true,"groundTruthRestorationPassed":true,"immutableDiffCount":0,"knownGoodPassed":true,"nonGroundTruthRestorationPassed":false,"reportHash":"sha256:b843f989cfdc1cc1be2cf3d9a01bac90866a5a01f0e160b4daa723ada47d2771","schemaVersion":1}
