{"behaviorDivergedBeforeVerification":true,"exactlyOneHarnessComponentChanged":true,"faultyPassed":false,"faultyReplayHashes":["sha256:3522d7e3928ba9f6930c69d605c34f358c5342ef07c79ce8376b30b297008208","sha256:3522d7e3928ba9f6930c69d605c34f358c5342ef07c79ce8376b30b297008208","sha256:3522d7e3928ba9f6930c69d605c34f358c5342ef07c79ce8376b30b297008208"],"faultyReplayHashesIdentical":true,"fixtureId":"hfb-v0-memory-retrieval-policy-02","goodReplayHashes":["sha256:5ec9fbea0b1f2be3e8eb16ae01e38316e5954589da683100bffd8d3508b62864","sha256:5ec9fbea0b1f2be3e8eb16ae01e38316e5954589da683100bffd8d3508b62864","sha256:5ec9fbea0b1f2be3e8eb16ae01e38316e5954589da683100bffd8d3508b62864"],"goodReplayHashesIdentical":true,"groundTruthRestorationPassed":true,"immutableDiffCount":0,"knownGoodPassed":true,"nonGroundTruthRestorationPassed":false,"reportHash":"sha256:2f62c87902131d262a29e4fea548f9f731781a41c711716c4ac0522b6ae73b1e","schemaVersion":1}
