{"behaviorDivergedBeforeVerification":true,"exactlyOneHarnessComponentChanged":true,"faultyPassed":false,"faultyReplayHashes":["sha256:54931fd38c52e4cbc45aeb0a11b6d9d9cb5c1a78b097fea4f53b48f579a1ce83","sha256:54931fd38c52e4cbc45aeb0a11b6d9d9cb5c1a78b097fea4f53b48f579a1ce83","sha256:54931fd38c52e4cbc45aeb0a11b6d9d9cb5c1a78b097fea4f53b48f579a1ce83"],"faultyReplayHashesIdentical":true,"fixtureId":"hfb-v0-workflow-policy-04","goodReplayHashes":["sha256:d05c91f383c1bdfaa47f88827f787f6644a779455fc1bb614fd46eb964f28085","sha256:d05c91f383c1bdfaa47f88827f787f6644a779455fc1bb614fd46eb964f28085","sha256:d05c91f383c1bdfaa47f88827f787f6644a779455fc1bb614fd46eb964f28085"],"goodReplayHashesIdentical":true,"groundTruthRestorationPassed":true,"immutableDiffCount":0,"knownGoodPassed":true,"nonGroundTruthRestorationPassed":false,"reportHash":"sha256:b1c8c537fdb1e41d89b5b74b819cdb9eb0ed062d57759863599e369dce9bcd21","schemaVersion":1}
