{"behaviorDivergedBeforeVerification":true,"exactlyOneHarnessComponentChanged":true,"faultyPassed":false,"faultyReplayHashes":["sha256:7da64f7fb6a6f3e5f25eca3ffd54da66888a8251d105d2a633e4f5bf2af6b0ab","sha256:7da64f7fb6a6f3e5f25eca3ffd54da66888a8251d105d2a633e4f5bf2af6b0ab","sha256:7da64f7fb6a6f3e5f25eca3ffd54da66888a8251d105d2a633e4f5bf2af6b0ab"],"faultyReplayHashesIdentical":true,"fixtureId":"hfb-v0-skill-04","goodReplayHashes":["sha256:9d8d2a6c923614d149e46a97357951d2b37c4c66d5ab9c2b30fe401578c76b0f","sha256:9d8d2a6c923614d149e46a97357951d2b37c4c66d5ab9c2b30fe401578c76b0f","sha256:9d8d2a6c923614d149e46a97357951d2b37c4c66d5ab9c2b30fe401578c76b0f"],"goodReplayHashesIdentical":true,"groundTruthRestorationPassed":true,"immutableDiffCount":0,"knownGoodPassed":true,"nonGroundTruthRestorationPassed":false,"reportHash":"sha256:52360c64573bddb892222d18c955ae46751371e6999c8e70f161b00ce641da3f","schemaVersion":1}
