{"behaviorDivergedBeforeVerification":true,"exactlyOneHarnessComponentChanged":true,"faultyPassed":false,"faultyReplayHashes":["sha256:93839b8bd8f5a95cb1fb56970f4b0221d7125d10a52d8051e5bf1da5232d633b","sha256:93839b8bd8f5a95cb1fb56970f4b0221d7125d10a52d8051e5bf1da5232d633b","sha256:93839b8bd8f5a95cb1fb56970f4b0221d7125d10a52d8051e5bf1da5232d633b"],"faultyReplayHashesIdentical":true,"fixtureId":"hfb-v0-tool-description-04","goodReplayHashes":["sha256:db511ce2dc0455a71f9ca240b71ee3fc323e6bcca269f5f8e63fe773a50214fa","sha256:db511ce2dc0455a71f9ca240b71ee3fc323e6bcca269f5f8e63fe773a50214fa","sha256:db511ce2dc0455a71f9ca240b71ee3fc323e6bcca269f5f8e63fe773a50214fa"],"goodReplayHashesIdentical":true,"groundTruthRestorationPassed":true,"immutableDiffCount":0,"knownGoodPassed":true,"nonGroundTruthRestorationPassed":false,"reportHash":"sha256:9bd55f0e5ae32a64d412ec3deb4a2842c56518dc22dc760ae68cdd719b40d2db","schemaVersion":1}
