{"behaviorDivergedBeforeVerification":true,"exactlyOneHarnessComponentChanged":true,"faultyPassed":false,"faultyReplayHashes":["sha256:cf0337ade4ac408db71f6e563fdced13fba0107987f15913732259ce2df9d5a6","sha256:cf0337ade4ac408db71f6e563fdced13fba0107987f15913732259ce2df9d5a6","sha256:cf0337ade4ac408db71f6e563fdced13fba0107987f15913732259ce2df9d5a6"],"faultyReplayHashesIdentical":true,"fixtureId":"hfb-v0-memory-retrieval-policy-03","goodReplayHashes":["sha256:c939a52cf94e73d5a2f53754ae8b03abdfa312aceb92a350eebcbab957ecac12","sha256:c939a52cf94e73d5a2f53754ae8b03abdfa312aceb92a350eebcbab957ecac12","sha256:c939a52cf94e73d5a2f53754ae8b03abdfa312aceb92a350eebcbab957ecac12"],"goodReplayHashesIdentical":true,"groundTruthRestorationPassed":true,"immutableDiffCount":0,"knownGoodPassed":true,"nonGroundTruthRestorationPassed":false,"reportHash":"sha256:2fff49883afdecc1e9c1edf4a8444a7938d8fa3bd35f2eff4ed38b0a40d0ece0","schemaVersion":1}
