{"behaviorDivergedBeforeVerification":true,"exactlyOneHarnessComponentChanged":true,"faultyPassed":false,"faultyReplayHashes":["sha256:3d62c87fb61658241f7da208699a9717b315383b4f4be1f2e2187aadd417fcd1","sha256:3d62c87fb61658241f7da208699a9717b315383b4f4be1f2e2187aadd417fcd1","sha256:3d62c87fb61658241f7da208699a9717b315383b4f4be1f2e2187aadd417fcd1"],"faultyReplayHashesIdentical":true,"fixtureId":"hfb-v0-workflow-policy-03","goodReplayHashes":["sha256:a05748a34a95e0d09d9b796d7eb71f98f831081e953a9c11c5e6151a65f92625","sha256:a05748a34a95e0d09d9b796d7eb71f98f831081e953a9c11c5e6151a65f92625","sha256:a05748a34a95e0d09d9b796d7eb71f98f831081e953a9c11c5e6151a65f92625"],"goodReplayHashesIdentical":true,"groundTruthRestorationPassed":true,"immutableDiffCount":0,"knownGoodPassed":true,"nonGroundTruthRestorationPassed":false,"reportHash":"sha256:248abf132162f2bc9debc4bd612c1367732474f8c0a3b498dba07806537e23d3","schemaVersion":1}
