{"behaviorDivergedBeforeVerification":true,"exactlyOneHarnessComponentChanged":true,"faultyPassed":false,"faultyReplayHashes":["sha256:e88f749424ce3ab4dfc8435a27129e972b8f97fae7b62ec04474296c73dfcb96","sha256:e88f749424ce3ab4dfc8435a27129e972b8f97fae7b62ec04474296c73dfcb96","sha256:e88f749424ce3ab4dfc8435a27129e972b8f97fae7b62ec04474296c73dfcb96"],"faultyReplayHashesIdentical":true,"fixtureId":"hfb-v0-context-policy-03","goodReplayHashes":["sha256:36ceb0446fc11209da23998f807f1292b66aaa04b07991b239ab00eaeeda7970","sha256:36ceb0446fc11209da23998f807f1292b66aaa04b07991b239ab00eaeeda7970","sha256:36ceb0446fc11209da23998f807f1292b66aaa04b07991b239ab00eaeeda7970"],"goodReplayHashesIdentical":true,"groundTruthRestorationPassed":true,"immutableDiffCount":0,"knownGoodPassed":true,"nonGroundTruthRestorationPassed":false,"reportHash":"sha256:7c4f4a75f3f10ff66d1b7a0d7082b1cee2e88d71c5a5aebb381907166f1db1fb","schemaVersion":1}
