{"behaviorDivergedBeforeVerification":true,"exactlyOneHarnessComponentChanged":true,"faultyPassed":false,"faultyReplayHashes":["sha256:6df25d441e6884698dc8cecf9e203091a64993e397cb686fd5c07e09da60b89f","sha256:6df25d441e6884698dc8cecf9e203091a64993e397cb686fd5c07e09da60b89f","sha256:6df25d441e6884698dc8cecf9e203091a64993e397cb686fd5c07e09da60b89f"],"faultyReplayHashesIdentical":true,"fixtureId":"hfb-v0-tool-description-01","goodReplayHashes":["sha256:088f5c27c133e0f6a8f6515e871557843254430a16ddd2052dfe846a3ca2a983","sha256:088f5c27c133e0f6a8f6515e871557843254430a16ddd2052dfe846a3ca2a983","sha256:088f5c27c133e0f6a8f6515e871557843254430a16ddd2052dfe846a3ca2a983"],"goodReplayHashesIdentical":true,"groundTruthRestorationPassed":true,"immutableDiffCount":0,"knownGoodPassed":true,"nonGroundTruthRestorationPassed":false,"reportHash":"sha256:3a23573a1c186916b51c10ae73e59660a83fd47593c7f6f1a7090bbf8bd5256f","schemaVersion":1}
