{"behaviorDivergedBeforeVerification":true,"exactlyOneHarnessComponentChanged":true,"faultyPassed":false,"faultyReplayHashes":["sha256:132c0b05ead16e3223f9147132eb7000865acc26094380617c906974eaa2fbe6","sha256:132c0b05ead16e3223f9147132eb7000865acc26094380617c906974eaa2fbe6","sha256:132c0b05ead16e3223f9147132eb7000865acc26094380617c906974eaa2fbe6"],"faultyReplayHashesIdentical":true,"fixtureId":"hfb-v0-context-policy-02","goodReplayHashes":["sha256:a98faa8c7945641f1ed77f92f38596cd10012d50a3b8d2b82c8c6e0926f9ff72","sha256:a98faa8c7945641f1ed77f92f38596cd10012d50a3b8d2b82c8c6e0926f9ff72","sha256:a98faa8c7945641f1ed77f92f38596cd10012d50a3b8d2b82c8c6e0926f9ff72"],"goodReplayHashesIdentical":true,"groundTruthRestorationPassed":true,"immutableDiffCount":0,"knownGoodPassed":true,"nonGroundTruthRestorationPassed":false,"reportHash":"sha256:363cb3232ceaf029e1466514c466a90263a0cebb9925ecf53db9c11963fa8cc6","schemaVersion":1}
