{"behaviorDivergedBeforeVerification":true,"exactlyOneHarnessComponentChanged":true,"faultyPassed":false,"faultyReplayHashes":["sha256:777aaf9a7157c1ef0317f6a20f35ef78ab402bcd60ba0d0423f234d719996576","sha256:777aaf9a7157c1ef0317f6a20f35ef78ab402bcd60ba0d0423f234d719996576","sha256:777aaf9a7157c1ef0317f6a20f35ef78ab402bcd60ba0d0423f234d719996576"],"faultyReplayHashesIdentical":true,"fixtureId":"hfb-v0-system-prompt-01","goodReplayHashes":["sha256:9b34b15c0fd50cc9e2ce3c01a3c94d3cde5c923966e1fb52581902700d4fc4be","sha256:9b34b15c0fd50cc9e2ce3c01a3c94d3cde5c923966e1fb52581902700d4fc4be","sha256:9b34b15c0fd50cc9e2ce3c01a3c94d3cde5c923966e1fb52581902700d4fc4be"],"goodReplayHashesIdentical":true,"groundTruthRestorationPassed":true,"immutableDiffCount":0,"knownGoodPassed":true,"nonGroundTruthRestorationPassed":false,"reportHash":"sha256:216e5bb2a3a4c5c2b55ffddd3b0deb69307d07db1616ff0e7bfa96dbc3bad900","schemaVersion":1}
