{"behaviorDivergedBeforeVerification":true,"exactlyOneHarnessComponentChanged":true,"faultyPassed":false,"faultyReplayHashes":["sha256:75c72c48b9371ec895fef5caeab57ff0a4fa0f9975167320bbfd33f8525e2111","sha256:75c72c48b9371ec895fef5caeab57ff0a4fa0f9975167320bbfd33f8525e2111","sha256:75c72c48b9371ec895fef5caeab57ff0a4fa0f9975167320bbfd33f8525e2111"],"faultyReplayHashesIdentical":true,"fixtureId":"hfb-v0-routing-subagent-02","goodReplayHashes":["sha256:ad801712e5c3d77e239fa849a6a8040c9cc2e085c89289309d34a34248963f41","sha256:ad801712e5c3d77e239fa849a6a8040c9cc2e085c89289309d34a34248963f41","sha256:ad801712e5c3d77e239fa849a6a8040c9cc2e085c89289309d34a34248963f41"],"goodReplayHashesIdentical":true,"groundTruthRestorationPassed":true,"immutableDiffCount":0,"knownGoodPassed":true,"nonGroundTruthRestorationPassed":false,"reportHash":"sha256:410c443537f4c62dcf2b069a448848b987451cc1f8d5962b99950bb5531e43b1","schemaVersion":1}
