{"behaviorDivergedBeforeVerification":true,"exactlyOneHarnessComponentChanged":true,"faultyPassed":false,"faultyReplayHashes":["sha256:e5046fe1f94fa70c30a2d7e663817c35826a4b7869daa7de42ba2278030589fc","sha256:e5046fe1f94fa70c30a2d7e663817c35826a4b7869daa7de42ba2278030589fc","sha256:e5046fe1f94fa70c30a2d7e663817c35826a4b7869daa7de42ba2278030589fc"],"faultyReplayHashesIdentical":true,"fixtureId":"hfb-v0-system-prompt-04","goodReplayHashes":["sha256:095925defd32549f2bc5aa3b2fa4c9d37293c42b31e52c1619c41b6098ee855e","sha256:095925defd32549f2bc5aa3b2fa4c9d37293c42b31e52c1619c41b6098ee855e","sha256:095925defd32549f2bc5aa3b2fa4c9d37293c42b31e52c1619c41b6098ee855e"],"goodReplayHashesIdentical":true,"groundTruthRestorationPassed":true,"immutableDiffCount":0,"knownGoodPassed":true,"nonGroundTruthRestorationPassed":false,"reportHash":"sha256:fbffe883c251d27b02ba7161c663c35359b72db767a11fc2a0994c69c4d654d0","schemaVersion":1}
