{"behaviorDivergedBeforeVerification":true,"exactlyOneHarnessComponentChanged":true,"faultyPassed":false,"faultyReplayHashes":["sha256:c0c1f8cc19f283a186bbde2bdc50e5fa10cd3630a1b1a488a90926c8353fd3e2","sha256:c0c1f8cc19f283a186bbde2bdc50e5fa10cd3630a1b1a488a90926c8353fd3e2","sha256:c0c1f8cc19f283a186bbde2bdc50e5fa10cd3630a1b1a488a90926c8353fd3e2"],"faultyReplayHashesIdentical":true,"fixtureId":"hfb-v0-context-policy-01","goodReplayHashes":["sha256:7ef248fd64d4c18b38b5e5192055978e93a84a570efdc397fc69fc89b30533d1","sha256:7ef248fd64d4c18b38b5e5192055978e93a84a570efdc397fc69fc89b30533d1","sha256:7ef248fd64d4c18b38b5e5192055978e93a84a570efdc397fc69fc89b30533d1"],"goodReplayHashesIdentical":true,"groundTruthRestorationPassed":true,"immutableDiffCount":0,"knownGoodPassed":true,"nonGroundTruthRestorationPassed":false,"reportHash":"sha256:4b5ecd820f76e19967a539c3684e5af253548d104f1f0002e3be5307c61b3fb8","schemaVersion":1}
