{"behaviorDivergedBeforeVerification":true,"exactlyOneHarnessComponentChanged":true,"faultyPassed":false,"faultyReplayHashes":["sha256:0873860d31ffba0380352a67e704e35606fbfa02611ac9159527d7e9d9c3a30a","sha256:0873860d31ffba0380352a67e704e35606fbfa02611ac9159527d7e9d9c3a30a","sha256:0873860d31ffba0380352a67e704e35606fbfa02611ac9159527d7e9d9c3a30a"],"faultyReplayHashesIdentical":true,"fixtureId":"hfb-v0-system-prompt-02","goodReplayHashes":["sha256:76d93abc4ca16a72d8508d20c1c04a399d1101a0048a0d2879c9fa9bd889e4e9","sha256:76d93abc4ca16a72d8508d20c1c04a399d1101a0048a0d2879c9fa9bd889e4e9","sha256:76d93abc4ca16a72d8508d20c1c04a399d1101a0048a0d2879c9fa9bd889e4e9"],"goodReplayHashesIdentical":true,"groundTruthRestorationPassed":true,"immutableDiffCount":0,"knownGoodPassed":true,"nonGroundTruthRestorationPassed":false,"reportHash":"sha256:35f6d0fdb7d5782c2532f5d41b9321a734118515879850df11189add112a5aec","schemaVersion":1}
