{"behaviorDivergedBeforeVerification":true,"exactlyOneHarnessComponentChanged":true,"faultyPassed":false,"faultyReplayHashes":["sha256:85b67179d6cd1e577b6a59d9c28c4825772e95fc5e0c68653b239c069e2c9d96","sha256:85b67179d6cd1e577b6a59d9c28c4825772e95fc5e0c68653b239c069e2c9d96","sha256:85b67179d6cd1e577b6a59d9c28c4825772e95fc5e0c68653b239c069e2c9d96"],"faultyReplayHashesIdentical":true,"fixtureId":"hfb-v0-workflow-policy-02","goodReplayHashes":["sha256:7e011b432672235058012fc81f900f116efa8005ce7e5abe0b6f47b7fc43cc3c","sha256:7e011b432672235058012fc81f900f116efa8005ce7e5abe0b6f47b7fc43cc3c","sha256:7e011b432672235058012fc81f900f116efa8005ce7e5abe0b6f47b7fc43cc3c"],"goodReplayHashesIdentical":true,"groundTruthRestorationPassed":true,"immutableDiffCount":0,"knownGoodPassed":true,"nonGroundTruthRestorationPassed":false,"reportHash":"sha256:17753fe5f3b4a915cfe310605f6e0e241df5a92268a9829d162c801c999d1d58","schemaVersion":1}
