{"behaviorDivergedBeforeVerification":true,"exactlyOneHarnessComponentChanged":true,"faultyPassed":false,"faultyReplayHashes":["sha256:b046e0267f2fb2a086cdb6e432eba889cb2963d77fef21ece68cd839f01c8912","sha256:b046e0267f2fb2a086cdb6e432eba889cb2963d77fef21ece68cd839f01c8912","sha256:b046e0267f2fb2a086cdb6e432eba889cb2963d77fef21ece68cd839f01c8912"],"faultyReplayHashesIdentical":true,"fixtureId":"hfb-v0-workflow-policy-01","goodReplayHashes":["sha256:63afcb85988619e448e0e4fb773020b5ead65fc86c2b6a4b6eb1ac4aa3f3166e","sha256:63afcb85988619e448e0e4fb773020b5ead65fc86c2b6a4b6eb1ac4aa3f3166e","sha256:63afcb85988619e448e0e4fb773020b5ead65fc86c2b6a4b6eb1ac4aa3f3166e"],"goodReplayHashesIdentical":true,"groundTruthRestorationPassed":true,"immutableDiffCount":0,"knownGoodPassed":true,"nonGroundTruthRestorationPassed":false,"reportHash":"sha256:cf1faa14736a5697307710addaa452726a8023be4a699b9d346cb708ffdc9293","schemaVersion":1}
