{"behaviorDivergedBeforeVerification":true,"exactlyOneHarnessComponentChanged":true,"faultyPassed":false,"faultyReplayHashes":["sha256:dd3e30916c883a7723928b882a0b71e54b9debf2cde6ed0d410c6e96fd8ab333","sha256:dd3e30916c883a7723928b882a0b71e54b9debf2cde6ed0d410c6e96fd8ab333","sha256:dd3e30916c883a7723928b882a0b71e54b9debf2cde6ed0d410c6e96fd8ab333"],"faultyReplayHashesIdentical":true,"fixtureId":"hfb-v0-system-prompt-03","goodReplayHashes":["sha256:aa7b51bf087bb13103d8e4290a007d339f83343272635fdcab271cf47d88c45b","sha256:aa7b51bf087bb13103d8e4290a007d339f83343272635fdcab271cf47d88c45b","sha256:aa7b51bf087bb13103d8e4290a007d339f83343272635fdcab271cf47d88c45b"],"goodReplayHashesIdentical":true,"groundTruthRestorationPassed":true,"immutableDiffCount":0,"knownGoodPassed":true,"nonGroundTruthRestorationPassed":false,"reportHash":"sha256:5e6bfb45affae05519918ad3985547845296e2e20ba89dfc9512162eda3aac95","schemaVersion":1}
