{"behaviorDivergedBeforeVerification":true,"exactlyOneHarnessComponentChanged":true,"faultyPassed":false,"faultyReplayHashes":["sha256:80da8772c62143c4412359846241052adca2a46214714834a7c0ab9e768e07e0","sha256:80da8772c62143c4412359846241052adca2a46214714834a7c0ab9e768e07e0","sha256:80da8772c62143c4412359846241052adca2a46214714834a7c0ab9e768e07e0"],"faultyReplayHashesIdentical":true,"fixtureId":"hfb-v0-tool-description-03","goodReplayHashes":["sha256:481f2d81e3787fd0b7bad2d4dd7a82c4b39856108954ea7610d7762c38dd6504","sha256:481f2d81e3787fd0b7bad2d4dd7a82c4b39856108954ea7610d7762c38dd6504","sha256:481f2d81e3787fd0b7bad2d4dd7a82c4b39856108954ea7610d7762c38dd6504"],"goodReplayHashesIdentical":true,"groundTruthRestorationPassed":true,"immutableDiffCount":0,"knownGoodPassed":true,"nonGroundTruthRestorationPassed":false,"reportHash":"sha256:5bb23661a90fce0e701ec1923306d547de6b949cffaee00ed31c32cdc1e20bce","schemaVersion":1}
