{"behaviorDivergedBeforeVerification":true,"exactlyOneHarnessComponentChanged":true,"faultyPassed":false,"faultyReplayHashes":["sha256:4e72c65baac5ca1535db1aee7b79fcf8335541f0bc497231fc0962e092ffdf71","sha256:4e72c65baac5ca1535db1aee7b79fcf8335541f0bc497231fc0962e092ffdf71","sha256:4e72c65baac5ca1535db1aee7b79fcf8335541f0bc497231fc0962e092ffdf71"],"faultyReplayHashesIdentical":true,"fixtureId":"hfb-v0-memory-retrieval-policy-04","goodReplayHashes":["sha256:fcede1752548fcf16d868dcb6a49e0b5c22a84b2a1d89cf1bcf3634b77cd1a94","sha256:fcede1752548fcf16d868dcb6a49e0b5c22a84b2a1d89cf1bcf3634b77cd1a94","sha256:fcede1752548fcf16d868dcb6a49e0b5c22a84b2a1d89cf1bcf3634b77cd1a94"],"goodReplayHashesIdentical":true,"groundTruthRestorationPassed":true,"immutableDiffCount":0,"knownGoodPassed":true,"nonGroundTruthRestorationPassed":false,"reportHash":"sha256:5ae33392f23b013158b175ec6abde97d270b0c40b9c00cdaba0f66308b9e9452","schemaVersion":1}
