{"behaviorDivergedBeforeVerification":true,"exactlyOneHarnessComponentChanged":true,"faultyPassed":false,"faultyReplayHashes":["sha256:a539c4d86cd2791e6fedcd036bb1138ac627a6207f4fd1fee9eb45a3d4726093","sha256:a539c4d86cd2791e6fedcd036bb1138ac627a6207f4fd1fee9eb45a3d4726093","sha256:a539c4d86cd2791e6fedcd036bb1138ac627a6207f4fd1fee9eb45a3d4726093"],"faultyReplayHashesIdentical":true,"fixtureId":"hfb-v0-skill-03","goodReplayHashes":["sha256:5b301d84e1830e60efd43dfb8709cb8ee949cd6d091f8710a27b274e74e4ffce","sha256:5b301d84e1830e60efd43dfb8709cb8ee949cd6d091f8710a27b274e74e4ffce","sha256:5b301d84e1830e60efd43dfb8709cb8ee949cd6d091f8710a27b274e74e4ffce"],"goodReplayHashesIdentical":true,"groundTruthRestorationPassed":true,"immutableDiffCount":0,"knownGoodPassed":true,"nonGroundTruthRestorationPassed":false,"reportHash":"sha256:91e972095fc7215a2afb7cbdcf34e30508244c805502dc8795724856e7b62526","schemaVersion":1}
