{"behaviorDivergedBeforeVerification":true,"exactlyOneHarnessComponentChanged":true,"faultyPassed":false,"faultyReplayHashes":["sha256:ae53773f4078103e9869fde8562a7fb26253e4fa2f7f02ac484603cd34b276cf","sha256:ae53773f4078103e9869fde8562a7fb26253e4fa2f7f02ac484603cd34b276cf","sha256:ae53773f4078103e9869fde8562a7fb26253e4fa2f7f02ac484603cd34b276cf"],"faultyReplayHashesIdentical":true,"fixtureId":"hfb-v0-tool-description-02","goodReplayHashes":["sha256:55e064c2c38ea33abe5aebd3fda7ad02acc90a01361d2837c5a2bbe4124c87cc","sha256:55e064c2c38ea33abe5aebd3fda7ad02acc90a01361d2837c5a2bbe4124c87cc","sha256:55e064c2c38ea33abe5aebd3fda7ad02acc90a01361d2837c5a2bbe4124c87cc"],"goodReplayHashesIdentical":true,"groundTruthRestorationPassed":true,"immutableDiffCount":0,"knownGoodPassed":true,"nonGroundTruthRestorationPassed":false,"reportHash":"sha256:179b4ec1f3524fcf1ce629ff97964df475e96203b586777903bc9987044c8a82","schemaVersion":1}
