{"behaviorDivergedBeforeVerification":true,"exactlyOneHarnessComponentChanged":true,"faultyPassed":false,"faultyReplayHashes":["sha256:17f9baf24b0a57e6ec655c72b9a08976333de57af3d560cedcd53a8f22dc3e9b","sha256:17f9baf24b0a57e6ec655c72b9a08976333de57af3d560cedcd53a8f22dc3e9b","sha256:17f9baf24b0a57e6ec655c72b9a08976333de57af3d560cedcd53a8f22dc3e9b"],"faultyReplayHashesIdentical":true,"fixtureId":"hfb-v0-skill-01","goodReplayHashes":["sha256:eed39cebd371a61e7aca7ceabe6b493994fbf123c83e52cae688b88916c27733","sha256:eed39cebd371a61e7aca7ceabe6b493994fbf123c83e52cae688b88916c27733","sha256:eed39cebd371a61e7aca7ceabe6b493994fbf123c83e52cae688b88916c27733"],"goodReplayHashesIdentical":true,"groundTruthRestorationPassed":true,"immutableDiffCount":0,"knownGoodPassed":true,"nonGroundTruthRestorationPassed":false,"reportHash":"sha256:5dea3adf2b7129a3085a25d24d752037ec8a2a660f260e6e0930ce0699fe4560","schemaVersion":1}
