{"behaviorDivergedBeforeVerification":true,"exactlyOneHarnessComponentChanged":true,"faultyPassed":false,"faultyReplayHashes":["sha256:90c7c523fd216787d225fd5ba57b9c7db61570b15499155d99e0695ec0654d6d","sha256:90c7c523fd216787d225fd5ba57b9c7db61570b15499155d99e0695ec0654d6d","sha256:90c7c523fd216787d225fd5ba57b9c7db61570b15499155d99e0695ec0654d6d"],"faultyReplayHashesIdentical":true,"fixtureId":"hfb-v0-skill-02","goodReplayHashes":["sha256:a639ec5de760a3747fcefa5c9c3793162fc181c1df6b38c0a2cac0ef2e6d5435","sha256:a639ec5de760a3747fcefa5c9c3793162fc181c1df6b38c0a2cac0ef2e6d5435","sha256:a639ec5de760a3747fcefa5c9c3793162fc181c1df6b38c0a2cac0ef2e6d5435"],"goodReplayHashesIdentical":true,"groundTruthRestorationPassed":true,"immutableDiffCount":0,"knownGoodPassed":true,"nonGroundTruthRestorationPassed":false,"reportHash":"sha256:704f65b1209c47df04c51a750ac41250ef6eca242f4d0d832e119fc3f1821b59","schemaVersion":1}
